{
  "contract": "ai-core-ui-ux-consumers/v1",
  "version": "1.1.0",
  "definition_of_done": {
    "required_conformant_consumers": 2,
    "current_conformant_consumers": 0,
    "status": "OPEN"
  },
  "consumers": [
    {
      "id": "freepass-sales",
      "repository": "freepass-creator/freepass-sales",
      "observed_revision": "fe69f76d81f4b9acd6f67f7b3f4ef5619f5e33d1",
      "relation": "EVIDENCE_SOURCE",
      "adoption_status": "EVIDENCE_ONLY",
      "feature_refs": [
        "workflow.explicit-save",
        "workflow.autosave",
        "integration.external-action",
        "navigation.restore",
        "system.input-method"
      ],
      "conformance_revision": null,
      "conformance_receipts": [],
      "evidence_refs": [
        "docs/coordination/FREEPASS_SALES_RUNTIME_LEARNING.md"
      ]
    },
    {
      "id": "freepasserp4",
      "repository": "freepass-creator/freepasserp4",
      "observed_revision": "de8823e754ee9f03c9d95a62fc031610cb7859c2",
      "relation": "CANONICAL_CONSUMER",
      "adoption_status": "MAPPED",
      "feature_refs": [
        "form.search",
        "data.filter",
        "data.sort",
        "data.list",
        "data.card",
        "data.table",
        "system.responsive",
        "system.safe-area-keyboard"
      ],
      "conformance_revision": null,
      "conformance_receipts": [],
      "evidence_refs": [
        "docs/coordination/ERP4_STABILITY_QUERY_LEARNING.md",
        "https://github.com/freepass-creator/freepasserp4/pull/435",
        "https://github.com/freepass-creator/freepasserp4/actions/runs/35443854623"
      ]
    },
    {
      "id": "freepass-admin",
      "repository": "freepass-creator/freepass-admin",
      "observed_revision": "a779fbe5bbb807a84e76362768a66ee1bc88f5d5",
      "relation": "CANONICAL_CONSUMER",
      "adoption_status": "MAPPED",
      "feature_refs": [
        "data.list-presentation",
        "data.search-discovery",
        "data.variant-selector",
        "data.master-detail",
        "navigation.bottom-action",
        "navigation.bottom-nav"
      ],
      "conformance_revision": null,
      "conformance_receipts": [],
      "evidence_refs": [
        "freepass-admin:docs/ui/ai-core-bindings.json",
        "freepass-admin:docs/ui/ADMIN-UI-UX-SSOT.md"
      ]
    }
  ]
}
